0,1
Data science for entrepreneurship research: studying demand dynamics for entrepreneurial skills in the Netherlands,1930.45748602676
Materialised view construction in data warehouse for decision making,1797.4631342450025
Machine Learning for High-Speed Corner Detection,1741.5093317643837
Pfam: The protein families database in 2021,1695.4964059533859
Making data science systems work,1691.5166582338602
The mnist database of handwritten digits,1669.1709260952841
Semantic Foggy Scene Understanding with Synthetic Data,1645.399408836267
Data Warehouses Federation as a Single Data Warehouse,1605.5546019575524
Joint 2D-3D-Semantic Data for Indoor Scene Understanding,1549.1765201140388
Data Warehouse and Big Data Integration,1548.7206525995057
dbSNP: the NCBI database of genetic variation,1530.7848108538806
Toward collaborative open data science in metabolomics using Jupyter Notebooks and cloud computing,1515.5134421742493
Design and application of Internet of things-based warehouse management system for smart logistics,1484.8330477418747
Fairness in Machine Learning: A Survey,1474.5338671598172
A Study on Big Data Integration with Data Warehouse,1470.9320052559099
Adversarial machine learning,1463.5306867318134
Data science approach to stock prices forecasting in Indonesia during Covid-19 using Long Short-Term Memory (LSTM),1446.7045636969265
HMDB 3.0—The Human Metabolome Database in 2013,1444.211891451207
The Role of ChatGPT in Data Science: How AI-Assisted Conversational Interfaces Are Revolutionizing the Field,1436.066908142706
COMPARATIVE STUDY OF DATA WAREHOUSE DESIGN APPROACHES : A SURVEY,1408.509469749309
CDD/SPARCLE: the conserved domain database in 2020,1395.0387065183515
In Search of Sustainable Design Patterns: Combining Data Mining and Semantic Data Modelling on Disparate Building Data,1388.3423315016769
Veridical data science,1377.5507515188963
Machine learning pipeline for battery state-of-health estimation,1375.2949659171215
From hype to reality: data science enabling personalized medicine,1373.7136082347158
"NCBI Reference Sequence (RefSeq): a curated non-redundant sequence database of genomes, transcripts and proteins",1367.885944845894
Mob-Warehouse: A Semantic Approach for Mobility Analysis with a Trajectory Data Warehouse,1342.4047599241567
Learning from Synthetic Data: Addressing Domain Shift for Semantic Segmentation,1339.1870765427545
ERFNet: Efficient Residual Factorized ConvNet for Real-Time Semantic Segmentation,1334.5197945155026
Building a Scalable Data Warehouse with Data Vault 2.0,1332.8189342810965
Algorithmic Government: Automating Public Services and Supporting Civil Servants in using Data Science Technologies,1309.8743706798712
Convolutional LSTM Network: A Machine Learning Approach for Precipitation Nowcasting,1291.4565805632103
Data Warehouse Systems: Design and Implementation,1285.1928456089597
Data Science,1280.935665060035
Neural Machine Translation by Jointly Learning to Align and Translate,1277.6465125229197
Scikit-learn: Machine Learning in Python,1273.4690851558153
Pattern Recognition and Machine Learning (Information Science and Statistics),1267.723307710248
Regularizing Deep Networks With Semantic Data Augmentation,1267.6259015295009
The PRIDE database and related tools and resources in 2019: improving support for quantification data,1260.7821551235531
A Data Warehouse Design for a Typical University Information System,1256.6583223484854
Big Data and data science: A critical review of issues for educational research,1255.877825766127
Machine learning in automated text categorization,1254.8473666359062
The HITRAN 2008 molecular spectroscopic database,1253.210600111835
An improved method of constructing a database of monthly climate observations and associated high‐resolution grids,1249.8459276218405
Domain Generalization via Model-Agnostic Learning of Semantic Features,1245.9147358023351
A survey of loss functions for semantic segmentation,1236.7420481050267
MouseMine: a new data warehouse for MGI,1231.755918440763
The ChEMBL database in 2017,1229.8297223756765
Constrained Language Models Yield Few-Shot Semantic Parsers,1207.4826675997579
Data Science,1190.5003009027398
Introducing EzBioCloud: a taxonomically united database of 16S rRNA gene sequences and whole-genome assemblies,1188.2751714755666
FedML: A Research Library and Benchmark for Federated Machine Learning,1174.1394219479685
The Snowflake Elastic Data Warehouse,1143.3650260771224
"The Art and Practice of Data Science Pipelines: A Comprehensive Study of Data Science Pipelines In Theory, In-The-Small, and In-The-Large",1141.7158605522059
Health Care and Precision Medicine Research: Analysis of a Scalable Data Science Platform,1138.0272093219758
The Role of Academia in Data Science Education,1135.8781403381054
Data science ethical considerations: a systematic literature review and proposed project framework,1133.1015437664978
Fashion-MNIST: a Novel Image Dataset for Benchmarking Machine Learning Algorithms,1131.9817994924522
"Automated Machine Learning - Methods, Systems, Challenges",1131.6963428668346
A comprehensive approach to data warehouse testing,1119.9476204023158
AutoDS: Towards Human-Centered Automation of Data Science,1111.199467810227
Data Warehouse Testing,1109.8019485163559
"Greengenes, a Chimera-Checked 16S rRNA Gene Database and Workbench Compatible with ARB",1109.3598078840225
Enabling Semantic Search Based on Conceptual Graphs over Encrypted Outsourced Data,1109.2761690238256
ZINC - A Free Database of Commercially Available Compounds for Virtual Screening,1106.674560982058
The case for data science in experimental chemistry: examples and recommendations,1099.4711036819974
The Pfam protein families database,1099.4144090930604
Automating data science,1097.7243253597894
"PlantCARE, a database of plant cis-acting regulatory elements and a portal to tools for in silico analysis of promoter sequences",1091.3796179108383
A Simple Baseline for Semi-supervised Semantic Segmentation with Strong Data Augmentation*,1089.8656466224572
Data Warehouse Systems,1071.2199265397542
"Towards GeoSpatial semantic data management: strengths, weaknesses, and challenges ahead",1060.9872202030656
Data Recombination for Neural Semantic Parsing,1055.1891245687189
Machine learning for alloys,1053.3888167728169
A Survey on Data Pricing: From Economics to Data Science,1053.0947874917022
Semantic data mapping technology to solve semantic data problem on heterogeneity aspect,1051.118905190696
The Deep Data Warehouse: Link-Based Integration and Enrichment of Warehouse Data and Unstructured Content,1047.6132210036253
Introduction to WordNet: An On-line Lexical Database,1047.1678784335445
50 Years of Data Science,1040.3804523802203
CRISP-DM Twenty Years Later: From Data Mining Processes to Data Science Trajectories,1023.9890912472575
A Solution to the Network Challenges of Data Recovery in Erasure-coded Distributed Storage Systems: A Study on the Facebook Warehouse Cluster,1019.7403800342646
ONCOMINE: a cancer microarray database and integrated data-mining platform.,1008.1242383253046
Understanding Machine Learning - From Theory to Algorithms,1008.0577552719695
Big Data Augmentation with Data Warehouse: A Survey,1003.5805795643353
An introduction to latent semantic analysis,985.492057978046
Data Cleaning In Data Warehouse: A Survey of Data Pre-processing Techniques and Tools,980.346707878476
The impact of the MIT-BIH Arrhythmia Database,972.4479204353491
High-Dimensional Probability: An Introduction with Applications in Data Science,970.7912835166769
Unsupervised Domain Adaptation for Semantic Segmentation via Class-Balanced Self-training,960.7917021871185
Semantic Data Integration for Knowledge Graph Construction at Query Time,956.7278055572611
Outbreak analytics: a developing data science for informing the response to emerging pathogens,956.7228286022357
Fundamentals of Database Systems,955.1751657387257
"QIIME 2: Reproducible, interactive, scalable, and extensible microbiome data science",952.1160040809501
Protein backbone angle restraints from searching a database for chemical shift and sequence homology,949.2674265215155
From Federated Databases to a Federated Data Warehouse System,947.7132716565203
"Reproduction for academic, not-for profit purposes permitted provided this text is included. A Data Warehouse Architecture for Clinical Data Warehousing",947.5112832761507
Learning Deep Features for Scene Recognition using Places Database,942.8244543995128
VSE++: Improving Visual-Semantic Embeddings with Hard Negatives,939.839365913321
"Practitioners Teaching Data Science in Industry and Academia: Expectations, Workflows, and Challenges",938.386730004681
GraphScale: Adding Expressive Reasoning to Semantic Data Stores,933.690556269763
The Data Warehouse Lifecycle Toolkit,930.6624874861546
Rich feature hierarchies for accurate object detection and semantic segmentation,928.7905793358827
The Cambridge Structural Database,928.2528769300765
A Data Science Framework for Movement,924.6352498679737
Data Warehouse Tuning: The Supremacy of Bitmap Index,924.034266806891
UCI Repository of machine learning databases,920.5416993346207
Data warehouse technology by infobright,920.3200180704382
Advanced Data Warehouse Design: From Conventional to Spatial and Temporal Applications,917.5948346146305
Exploring exploratory search: a user study with linked semantic data,917.2255353668198
Data Shapley: Equitable Valuation of Data for Machine Learning,916.6764710883472
Data Science and Machine Learning,916.2551190509249
Hive - a petabyte scale data warehouse using Hadoop,913.3363971298013
Advanced Real-Time Indoor Tracking Based on the Viterbi Algorithm and Semantic Data,913.1611203580492
The Democratization of Data Science Education,912.8131792391972
Extreme Learning Machine for Regression and Multiclass Classification,908.0617886852287
Machine Learning in Agriculture: A Review,907.3077127436824
Explainable AI: A Review of Machine Learning Interpretability Methods,906.5825177067559
Conceptual Data Warehouse Design,906.3042087202396
"Repbase Update, a database of repetitive elements in eukaryotic genomes",903.5415494747745
Semi-Supervised Semantic Segmentation with Cross Pseudo Supervision,902.9447282834785
Data science: a game changer for science and innovation,900.9181205269343
Evaluation of semantic data storages for integrating heterogenous disciplines in automation systems engineering,900.7028845008997
Federated Machine Learning,900.1023120022704
The Pfam protein families database,898.3627954342688
CARD 2020: antibiotic resistome surveillance with the comprehensive antibiotic resistance database,895.8052422212398
The Cambridge Structural Database: a quarter of a million crystal structures and rising.,892.6238400685108
Double/Debiased Machine Learning for Treatment and Structural Parameters,892.4162679371121
An Overview of Data Warehouse and Data Lake in Modern Enterprise Data Management,892.1297465536463
DrugBank 5.0: a major update to the DrugBank database for 2018,878.0105230354169
Fixed Point Strategies in Data Science,873.1435254378854
A business-oriented approach to data warehouse development,871.7086266697727
Understanding Machine Learning,868.5756312928385
Self-Ensembling With GAN-Based Data Augmentation for Domain Adaptation in Semantic Segmentation,867.3833620381467
A Systematic Review on Supervised and Unsupervised Machine Learning Algorithms for Data Science,866.2408250984797
Sherlock: A Deep Learning Approach to Semantic Data Type Detection,862.940209939327
Fairness in Machine Learning,862.1850092372948
Data Science for Local Government,858.8786332311503
"Reference sequence (RefSeq) database at NCBI: current status, taxonomic expansion, and functional annotation",858.4681909773433
Recent advances and applications of machine learning in solid-state materials science,857.6069770880367
"Data Science in 2020: Computing, Curricula, and Challenges for the Next 10 Years",856.9984629050078
Semantic Autoencoder for Zero-Shot Learning,853.757254605163
The Pfam protein families database in 2019,852.0930206079308
Semantic data mining: A survey of ontology-based approaches,851.9283204594215
SCOP: a structural classification of proteins database for the investigation of sequences and structures.,848.6329696286101
Model Adaptation with Synthetic and Real Data for Semantic Dense Foggy Scene Understanding,847.0378369497695
"How do Data Science Workers Collaborate? Roles, Workflows, and Tools",845.9646104753531
data warehouse,844.8048011843591
Towards an Architecture for Managing Big Semantic Data in Real-Time,844.7420223109941
Book Reviews: WordNet: An Electronic Lexical Database,844.4431208138743
Spectral Methods for Data Science: A Statistical Perspective,838.4860253229582
Spatiotemporal query processing for semantic data stream,837.2575888726604
A Survey on Bias and Fairness in Machine Learning,837.2228194950629
Counterfactual Explanations for Machine Learning: A Review,835.8999391817104
InterMine: a flexible data warehouse system for the integration and analysis of heterogeneous biological data,835.7957247879173
An Introduction to Machine Learning,831.6054681859932
Data warehouse testing,830.8578584266581
What Is Data Science,824.8505835487512
HMDB: A large video database for human motion recognition,824.6925957670255
The PRIDE database resources in 2022: a hub for mass spectrometry-based proteomics evidences,822.3619697275524
The use of the area under the ROC curve in the evaluation of machine learning algorithms,821.2167881648008
Fast-SCNN: Fast Semantic Segmentation Network,818.776899898909
WordNet: A Lexical Database for English,817.241542592099
Learning Semantic Segmentation From Synthetic Data: A Geometrically Guided Input-Output Adaptation Approach,814.8375614125199
Data Driven vs. Metric Driven Data Warehouse Design,809.8371695557627
The Immune Epitope Database (IEDB): 2018 update,803.1304696016542
IMG/M v.5.0: an integrated data management and comparative analysis system for microbial genomes and microbiomes,802.9870745374702
A Fuzzy Data Warehouse Approach for Web Analytics,802.9149422875049
LabelMe: A Database and Web-Based Tool for Image Annotation,799.793026536897
TRRUST v2: an expanded reference database of human and mouse transcriptional regulatory interactions,797.8441874666556
Challenges and opportunities in quantum machine learning,790.245064726687
Reconciling modern machine-learning practice and the classical bias–variance trade-off,788.2116793751695
The BioGRID interaction database: 2019 update,788.175615569223
SoilGrids250m: Global gridded soil information based on machine learning,787.984996452465
Physics-informed machine learning,784.3727433200733
Bayesian Optimization and Data Science,782.2687490339956
ilastik: interactive machine learning for (bio)image analysis,779.7966411892867
Rectifying Pseudo Label Learning via Uncertainty Estimation for Domain Adaptive Semantic Segmentation,776.7930074734943
RangeNet ++: Fast and Accurate LiDAR Semantic Segmentation,775.3982944921214
Geographic Data Science,774.324933257684
Programs for Machine Learning,773.1424501858858
Data Management for Data Science - Towards Embedded Analytics,770.4768041499442
The InterPro protein families and domains database: 20 years on,767.2358451276028
"Machine Learning in Python: Main developments and technology trends in data science, machine learning, and artificial intelligence",767.1256293919172
Schema Evolution for Data Warehouse: A Survey,766.3554603830431
On Hyperparameter Optimization of Machine Learning Algorithms: Theory and Practice,761.4504171144596
Pattern Based Feature Construction in Semantic Data Mining,761.188028845428
Thumbs up? Sentiment Classification using Machine Learning Techniques,756.8759091753126
From Business Intelligence to Semantic Data Stream Management,754.6913229994707
MRI-Based Brain Tumor Classification Using Ensemble of Deep Features and Machine Learning Classifiers,753.7167355904365
Human-AI Collaboration in Data Science,752.0087794124214
Rich Feature Hierarchies for Accurate Object Detection and Semantic Segmentation,746.7517755109512
Practical Black-Box Attacks against Machine Learning,746.5687437754922
"Our data, our society, our health: A vision for inclusive and transparent health data science in the United Kingdom and beyond",745.4141343324857
Freebase: a collaboratively created graph database for structuring human knowledge,743.0182135906992
PepeSearch: Semantic Data for the Masses,742.4033750681782
Towards Data Quality into the Data Warehouse Development,740.3063795473653
3D Semantic Segmentation with Submanifold Sparse Convolutional Networks,739.6032953175599
Multimodal Machine Learning: A Survey and Taxonomy,739.2176767186685
"Avogadro: an advanced semantic chemical editor, visualization, and analysis platform",738.4231453102084
Data science in data librarianship: Core competencies of a data librarian,735.9710995907948
Ubiquitous web navigation through harvesting embedded semantic data: A mobile scenario,734.7372913150136
Querying Semantic Data on the Web?,731.876036958268
PARCIV: Recognizing physical activities having complex interclass variations using semantic data of smartphone,728.065081992096
VHA Corporate Data Warehouse height and weight data: opportunities and challenges for health services research.,727.8967482896879
Large-Scale Machine Learning with Stochastic Gradient Descent,727.8532527776053
Using Ontologies for Semantic Data Integration,726.3829976789566
Geospatial data ontology: the semantic foundation of geospatial data integration and sharing,723.4741663591589
What is responsible and sustainable data science?,720.6240488047944
Semi-Supervised Semantic Segmentation With Cross-Consistency Training,718.6134495240268
MoleculeNet: a benchmark for molecular machine learning,718.1899691753774
The ecoinvent database version 3 (part I): overview and methodology,716.7352783505007
"Hands-On Machine Learning with Scikit-Learn and TensorFlow: Concepts, Tools, and Techniques to Build Intelligent Systems",710.8552440468469
YeastMine—an integrated data warehouse for Saccharomyces cerevisiae data as a multipurpose tool-kit,707.9666847293327
miRDB: an online database for prediction of functional microRNA targets,705.68413010692
Semantic Graph Convolutional Networks for 3D Human Pose Regression,704.5838403747239
Data science in economics: comprehensive review of advanced machine learning and deep learning methods,704.436518565155
The IPD-IMGT/HLA Database,703.1480957896706
The Cityscapes Dataset for Semantic Urban Scene Understanding,701.4549755953883
Data Warehouse Design: Modern Principles and Methodologies,693.7144068456055
Towards A Rigorous Science of Interpretable Machine Learning,692.8163867875353
"Machine Learning Testing: Survey, Landscapes and Horizons",689.024876267157
"A Solution to Plato's Problem: The Latent Semantic Analysis Theory of Acquisition, Induction, and Representation of Knowledge.",687.7588922806319
Adversarial Machine Learning at Scale,687.0732715467196
Optimizing data warehouse loading procedures for enabling useful-time data warehousing,685.4048183322598
The MNIST Database of Handwritten Digit Images for Machine Learning Research [Best of the Web],684.3298433300076
The MNIST Database of Handwritten Digit Images for Machine Learning Research [Best of the Web],684.3298433300076
Distance geometry and data science,682.7714290342861
"Kimball's Data Warehouse Toolkit Classics: The Data Warehouse Toolkit, 2nd Edition; The Data Warehouse Lifecycle, 2nd Edition; The Data Warehouse ETL Toolk",678.2522457084772
Power of data in quantum machine learning,678.1395340111192
Discovering Semantic Data of Interest from Un-mappable Memory with Confidence,677.5566251631938
TensorFlow: Large-Scale Machine Learning on Heterogeneous Distributed Systems,671.8516839202275
New tools in comparative political economy : the database of political institutions,670.1957500986658
Building the data warehouse,668.925724113644
Curriculum Model Adaptation with Synthetic and Real Data for Semantic Foggy Scene Understanding,666.9026322884342
Database resources of the National Center for Biotechnology Information.,661.7508773202666
"The KiTS19 Challenge Data: 300 Kidney Tumor Cases with Clinical Context, CT Semantic Segmentations, and Surgical Outcomes",659.7611224267653
Process Mining for Python (PM4Py): Bridging the Gap Between Process- and Data Science,655.5845669989462
Data Science,655.1863191590797
Genomics and data science: an application within an umbrella,652.9203145755264
Common pitfalls and recommendations for using machine learning to detect and prognosticate for COVID-19 using chest radiographs and CT scans,650.3648501277984
Open Graph Benchmark: Datasets for Machine Learning on Graphs,649.8130397098496
Modern Software Engineering Methodologies Meet Data Warehouse Design: 4WD,647.2852840068385
HMDB 4.0: the human metabolome database for 2018,646.0598066710935
Data science applications to string theory,642.707204646289
The Essence of Functional Programming on Semantic Data,642.057479499301
Data Science Support at the Academic Library,637.6388499944368
Comprehensive database for facial expression analysis,634.4000400655971
Membership Inference Attacks Against Machine Learning Models,634.2208285888697
"The MEROPS database of proteolytic enzymes, their substrates and inhibitors in 2017 and a comparison with peptidases in the PANTHER database",631.9196464738675
Machine learning and the physical sciences,629.866677836564
Developing a standardized healthcare cost data warehouse,628.7900109653601
Correlation-based Feature Selection for Machine Learning,627.5575648283105
The HITRAN2012 molecular spectroscopic database,626.8012395595832
Active Database Systems Triggers And Rules For Advanced Database Processing The Morgan Kaufmann Series In Data Management Systems,618.5432698318639
Effective Heart Disease Prediction Using Hybrid Machine Learning Techniques,618.3516542402507
Data Warehouse Refreshment,617.6240996430782
"How Data Science Workers Work with Data: Discovery, Capture, Curation, Design, Creation",609.7879311082776
TRUNCATULIX – a data warehouse for the legume community,609.1173134533767
The Data Warehouse Toolkit: The Complete Guide to Dimensional Modeling,609.0668676697221
IPD-IMGT/HLA Database,606.6543145864276
"The Changing Landscape of Machine Learning: A Comparative Analysis of Centralized Machine Learning, Distributed Machine Learning and Federated Machine Learning",606.0111283970557
Semantic Segmentation of Earth Observation Data Using Multimodal and Multi-scale Deep Networks,605.2056275194752
Data Warehouse,604.0979029764726
Alliance Rules for Data Warehouse Cleansing,602.4891358365505
Empirical studies to assess the understandability of data warehouse schemas using structural metrics,600.5183073088114
Upscaling urban data science for global climate solutions,599.6213646721451
Human Data Science,591.4153652770301
Data Mining Practical Machine Learning Tools and Techniques,588.9962146050929
Quantum embeddings for machine learning,581.0721568202902
The 9 Pitfalls of Data Science,577.1786945928369
Human-Centered Study of Data Science Work Practices,576.0613783120018
Learning deep structured semantic models for web search using clickthrough data,575.4454442639466
AnchorViz: Facilitating Classifier Error Discovery through Interactive Semantic Data Exploration,573.7339310046309
Open Data Science,573.6555729273027
Data Warehouse Performance,572.2905349799667
TCMSP: a database of systems pharmacology for drug discovery from herbal medicines,572.1647698589016
Argonaute—a database for gene regulation by mammalian microRNAs,569.7696557181965
Graph Data Warehouse: Steps to Integrating Graph Databases Into the Traditional Conceptual Structure of a Data Warehouse,565.3220064324045
Optimization and Machine Learning,562.7297689566407
"Semantic data interoperability, digital medicine, and e-health in infectious disease management: a review",562.0760935036734
Machine learning for molecular and materials science,555.490459262701
The Ribosomal Database Project: improved alignments and new tools for rRNA analysis,554.0882821423855
"Repbase Update, a database of eukaryotic repetitive elements",553.8881694006993
"Machine learning: Trends, perspectives, and prospects",553.3393664298525
"Definitions, methods, and applications in interpretable machine learning",553.2553721033256
A new paradigm for accelerating clinical data science at Stanford Medicine,552.9389794954269
Cybersecurity data science: an overview from machine learning perspective,546.6515722368775
Building a Data Warehouse: With Examples in SQL Server,546.0842017783207
ACM Task Force on Data Science Education: Draft Report and Opportunity for Feedback,538.8237699498626
Enriching Texture Analysis with Semantic Data,537.9902707915313
Machine Learning Interpretability: A Survey on Methods and Metrics,536.2413910007656
"The STRING database in 2011: functional interaction networks of proteins, globally integrated and scored",535.5414424619595
Ribosomal Database Project: data and tools for high throughput rRNA analysis,531.5958230860216
Semantic Data Extraction,523.4211968909156
Effective Use of Synthetic Data for Urban Scene Semantic Segmentation,520.8038236419891
The COG database: a tool for genome-scale analysis of protein functions and evolution,517.3892766435291
SUN database: Large-scale scene recognition from abbey to zoo,509.8713939516177
Knowledge Reasoning with Semantic Data for Real-Time Data Processing in Smart Factory,507.8660722788489
Analysis of Data Quality Aspects in Data Warehouse Systems,504.15946684367094
The Molecular Signatures Database (MSigDB) hallmark gene set collection.,503.3768612130989
Opening practice: supporting reproducibility and critical spatial data science,500.9280414084866
SystemDS: A Declarative Machine Learning System for the End-to-End Data Science Lifecycle,496.0860581523101
