0,1
2016 update of the PRIDE database and its related tools,492.1188766121033
A review of data science in business and industry and a future view,491.9981751858623
Theory-Guided Data Science: A New Paradigm for Scientific Discovery from Data,491.2565848296249
"Federated Learning: Collaborative Machine Learning without
Centralized Training Data",490.2685759500804
The Data Warehouse Toolkit: The Definitive Guide to Dimensional Modeling,488.80553433879936
Diversifying the genomic data science research community,484.855675446283
Machine learning - a probabilistic perspective,483.07372460924057
Introducing EzTaxon-e: a prokaryotic 16S rRNA gene sequence database with phylotypes that represent uncultured species.,480.24578707611005
Greengenes: Chimera-checked 16S rRNA gene database and workbench compatible in ARB,479.07107040523755
Unsupervised Intra-Domain Adaptation for Semantic Segmentation Through Self-Supervision,478.8088151072029
The Data Warehouse Toolkit: The Definitive Guide to Dimensional Modeling,478.7837172717917
Glossary for public health surveillance in the age of data science,471.2932204944492
DEAP: A Database for Emotion Analysis ;Using Physiological Signals,469.0225973358557
"Reproducible, interactive, scalable and extensible microbiome data science using QIIME 2",467.3128618661623
Optimization Methods for Large-Scale Machine Learning,466.77478581792667
ImageNet: A large-scale hierarchical image database,465.6595889685816
Molecular signatures database (MSigDB) 3.0,464.83347058903377
"Smart Health Intelligent Healthcare Systems in the Metaverse, Artificial Intelligence, and Data Science Era",464.8177202944357
Data science and AI in FinTech: an overview,464.75987832621354
Enhancing XML data warehouse query performance by fragmentation,464.1638853326902
Data Warehouse From Architecture To Implementation,459.5433571405236
Building an active semantic data warehouse for precision dairy farming,459.270134599725
Finding Related Tables in Data Lakes for Interactive Data Science,456.9834920097545
ResUNet-a: a deep learning framework for semantic segmentation of remotely sensed data,454.27819986327796
Data ethics,453.1420762969953
Encyclopedia of Database Systems,447.3690749250278
Learning Phrase Representations using RNN Encoder–Decoder for Statistical Machine Translation,437.2957880795981
Foundations of Data Science,434.21976118390864
Semantic data mining in the information age: A systematic review,433.2115472670035
A fast quantum mechanical algorithm for database search,429.51112130598153
Stop explaining black box machine learning models for high stakes decisions and use interpretable models instead,427.62356405056335
Classification Based on Decision Tree Algorithm for Machine Learning,426.5641481615521
The Challenge of Big Data and Data Science,423.3461319516366
Semantic data extraction over MQTT for IoTcentric wireless sensor networks,419.8834805405467
Data Science as Political Action: Grounding Data Science in a Politics of Justice,414.6668579880943
Cyclotron : Juggling data and queries for a data warehouse audience,410.98633425810306
Data Warehouse with Big Data Technology for Higher Education,410.96652849968353
ChEMBL: a large-scale bioactivity database for drug discovery,409.75203953805436
Visualizing Semantic Data,401.5722564029061
The SYNTHIA Dataset: A Large Collection of Synthetic Images for Semantic Segmentation of Urban Scenes,401.03836763378126
"The role of data science in healthcare advancements: applications, benefits, and future prospects",400.1144137287541
MitoMiner: a data warehouse for mitochondrial proteomics data,397.48090147865344
A Systematic Approach to Creation of a Perioperative Data Warehouse,384.70704004738866
Plant cis-acting regulatory DNA elements (PLACE) database: 1999,384.52902782257667
"Machine Learning: Algorithms, Real-World Applications and Research Directions",382.263140474417
The FERET database and evaluation procedure for face-recognition algorithms,380.7693914641647
Gapped BLAST and PSI-BLAST: a new generation of protein database search programs.,378.5686465305024
FuseSeg: Semantic Segmentation of Urban Scenes Based on RGB and Thermal Data Fusion,370.15667588538435
Adversarial Semantic Data Augmentation for Human Pose Estimation,370.14373944159985
Data Warehouse Governance Programs in Healthcare Settings: A Literature Review and a Call to Action,365.0519504355802
3D Semantic Parsing of Large-Scale Indoor Spaces,363.8009904838256
Coronavirus disease (COVID-19) cases analysis using machine-learning applications,356.7194197711826
SecureML: A System for Scalable Privacy-Preserving Machine Learning,355.7653802262639
The COG database: an updated version includes eukaryotes,354.01623478425915
Towards a Programmable Semantic Extract-Transform-Load Framework for Semantic Data Warehouses,352.15915907314275
The Molecular Signatures Database Hallmark Gene Set Collection,350.64976018599515
Implicit Semantic Data Augmentation for Deep Networks,350.4948908625136
The State of the Art of Data Science and Engineering in Structural Health Monitoring,349.0452288873155
Clinical Use of an Enterprise Data Warehouse,346.6322363061412
Supervised Machine Learning: A Review of Classification Techniques,345.90240119107904
A guide to machine learning for biologists,343.9484831019216
"Data Science in Healthcare: Benefits, Challenges and Opportunities",336.1994221292346
FDA: Fourier Domain Adaptation for Semantic Segmentation,334.07493714679873
Big-Data Science in Porous Materials: Materials Genomics and Machine Learning,333.10473106711737
Data science from a library and information science perspective,330.02795722046966
Situating Data Science: Exploring How Relationships to Data Shape Learning,329.59521958107774
"Improve Performance of Extract, Transform and Load (ETL) in Data Warehouse",325.8624837814463
A Platform for Urban Analytics and Semantic Data Integration in City Planning,325.45500931820925
"MIMIC-III, a freely accessible critical care database",322.82722873561596
A Database and Evaluation Methodology for Optical Flow,322.50667145879936
Engineering IoT Healthcare Applications: Towards a Semantic Data Driven Sustainable Architecture,319.2659091012808
Foundations of Machine Learning,315.6022555427672
What is Data Science?,314.82791424333044
Data Science,314.30738390673474
Towards the Systematic Reporting of the Energy and Carbon Footprints of Machine Learning,312.69631050612463
Data Warehouse,312.534733290361
MXNet: A Flexible and Efficient Machine Learning Library for Heterogeneous Distributed Systems,303.6732865311968
Labeled Faces in the Wild: A Database forStudying Face Recognition in Unconstrained Environments,303.2722311714808
Applications of machine learning in drug discovery and development,301.8815480671861
Tajo: A distributed data warehouse system on large clusters,298.6481317307962
Using the Semantic Web in digital humanities: Shift from data publishing to data-analysis and serendipitous knowledge discovery,295.2121451231513
"DAVID: Database for Annotation, Visualization, and Integrated Discovery",292.42837209278275
A Fresh Look at Introductory Data Science,292.3361437641255
Machine Learning With Python,291.0729794219426
Datawarehouser: A data warehouse artist who have ability to understand data warehouse schema pictures,289.25225638806893
Olap aggregation function for textual data warehouse,286.47899722401496
Semantic Data Integration,285.2090363714202
Semantic Communications in Networked Systems: A Data Significance Perspective,281.8984279425576
The Machine‐Learning Approach,281.0844188953617
Practical Secure Aggregation for Privacy-Preserving Machine Learning,268.51562945907
The AR face database,267.30068984082334
Machine Learning Basics,266.4916707480083
A clinician friendly data warehouse oriented toward narrative reports: Dr. Warehouse,264.405058712546
The data science life cycle,263.75688619199326
Stable learning establishes some common ground between causal inference and machine learning,263.3014969542193
INDIGO – INtegrated Data Warehouse of MIcrobial GenOmes with Examples from the Red Sea Extremophiles,262.12094334627295
Machine Learning,258.37687121538437
Evaluating Data Reliability: An Evidential Answer with Application to a Web-Enabled Data Warehouse,250.99318137450413
Warehouse management system customization and information availability in 3pl companies,244.52065515471492
Software Engineering for Machine Learning: A Case Study,241.21448458950601
Gaussian Processes For Machine Learning,237.61431649565557
The Pfam protein families database: towards a more sustainable future,234.2354210203787
Realizing the potential of data science,231.2595865051103
Exploring Cross-Image Pixel Contrast for Semantic Segmentation,229.47957774447755
GENEVESTIGATOR. Arabidopsis Microarray Database and Analysis Toolbox1[w],225.29075958037066
Statistical Foundations of Data Science,224.82085228109827
Gene Ontology Consortium: The Gene Ontology (GO) database and informatics resource,224.27994989624182
Machine learning and deep learning,224.17153937279718
Synthesizing Type-Detection Logic for Rich Semantic Data Types using Open-source Code,224.02903844385352
Interpretable Machine Learning,223.5372050392021
Automatic differentiation in machine learning: a survey,219.65943613421982
Data Science of the Natural Environment: A Research Roadmap,214.9982919387539
That’s So Annoying!!!: A Lexical and Frame-Semantic Embedding Based Data Augmentation Approach to Automatic Categorization of Annoying Behaviors using #petpeeve Tweets,214.72783145678918
Use data warehouse and data mining to predict student academic performance in schools: A case study (perspective application and benefits),213.1530561878452
The SILVA ribosomal RNA gene database project: improved data processing and web-based tools,210.79135436653053
A Decentralized Architecture for Sharing and Querying Semantic Data,204.8533573048636
Big Earth Data science: an information framework for a sustainable planet,202.5146578640153
Semantic Earth Observation Data Cubes,202.12008419850648
Teaching Creative and Practical Data Science at Scale,197.58896665082753
The Data Mining of the Human Resources Data Warehouse in University Based on Association Rule,197.31585359429704
Building the data warehouse,196.12618517081793
Pattern Recognition and Machine Learning,193.1212225673131
"Data Architecture: A Primer for the Data Scientist: Big Data, Data Warehouse and Data Vault",192.0192763426606
From Star Schemas to Big Data: 20+ Years of Data Warehouse Research,190.73162809893466
Knowledge-based Biomedical Data Science 2019,178.1164544618314
Data mining-based algorithm for storage location assignment in a randomised warehouse,171.31238108277697
Underspecification Presents Challenges for Credibility in Modern Machine Learning,168.6784877148226
C4.5: Programs for Machine Learning,167.80669040795473
Digital twin-driven joint optimisation of packing and storage assignment in large-scale automated high-rise warehouse product-service system,167.5670199627834
Architecture and Implementation of a Clinical Research Data Warehouse for Prostate Cancer,164.74063385253686
Database resources of the National Center for Biotechnology Information,159.31956688208157
Empirical statistical model to estimate the accuracy of peptide identifications made by MS/MS and database search.,158.80386736757603
A Survey: Data Warehouse Architecture,154.9075442682658
"The STRING database in 2017: quality-controlled protein–protein association networks, made broadly accessible",153.52059170936377
Deep visual-semantic alignments for generating image descriptions,144.23422094374348
"COVID-WAREHOUSE: A Data Warehouse of Italian COVID-19, Pollution, and Climate Data",143.65666442715064
Analisis Data dengan Menggunakan ERD dan Model Konseptual Data Warehouse,141.35750589080047
IEMOCAP: interactive emotional dyadic motion capture database,139.51019595527112
SemEval-2017 Task 1: Semantic Textual Similarity Multilingual and Crosslingual Focused Evaluation,139.05727256146028
Swarm Learning for decentralized and confidential clinical machine learning,132.26821425877077
Flexible automated warehouse: a literature review and an innovative framework,132.16509973507772
Conceptual Modeling Solutions for the Data Warehouse,125.43008088044964
The R Language: An Engine for Bioinformatics and Data Science,123.65742746298743
Machine learning–accelerated computational fluid dynamics,118.74208212208718
Supervised and Unsupervised Learning for Data Science,118.40947638883848
RCFile: A fast and space-efficient data placement structure in MapReduce-based warehouse systems,116.78504221619619
ADVENT: Adversarial Entropy Minimization for Domain Adaptation in Semantic Segmentation,113.69955968081022
CARD 2017: expansion and model-centric curation of the comprehensive antibiotic resistance database,112.65559609616624
An Enhanced Technique to Clean Data in the Data Warehouse,108.82719267076693
The Semantic Data Dictionary – An Approach for Describing and Annotating Data,102.40601496036729
Semantic data provisioning and reasoning for the Internet of Things,102.0093034254226
Eleven grand challenges in single-cell data science,101.99598662471733
Passing the Data Baton: A Retrospective Analysis on Data Science Work and Workers,100.04214418140393
Practical Bayesian Optimization of Machine Learning Algorithms,93.49622119814609
"Medical Big Data Warehouse: Architecture and System Design, a Case Study: Improving Healthcare Resources Distribution",93.38670185931373
A proposed model for data warehouse ETL processes,93.05372393585205
A global database of COVID-19 vaccinations,92.5125982461715
An ontology-guided semantic data integration framework to support integrative data analysis of cancer survival,91.88698776051393
"SemEHR: A general-purpose semantic search system to surface semantic data from clinical notes for tailored care, trial recruitment, and clinical research",91.16365766101829
Database resources of the National Center for Biotechnology Information,90.57102154379835
This Paper Is Included in the Proceedings of the 12th Usenix Symposium on Operating Systems Design and Implementation (osdi '16). Tensorflow: a System for Large-scale Machine Learning Tensorflow: a System for Large-scale Machine Learning,89.24261143429477
DW4TR: A Data Warehouse for Translational Research,83.68129853900992
Key organizational factors in data warehouse architecture selection,79.07858469540993
Probabilistic data association for semantic SLAM,78.65719575095638
The Gene Expression Omnibus Database,77.56006581641473
Interpretable Machine Learning: Fundamental Principles and 10 Grand Challenges,77.55798934631049
The HMO Research Network Virtual Data Warehouse: A Public Data Model to Support Collaboration,76.33493313567413
A Data Warehouse Solution for Analyzing RFID-Based Baggage Tracking Data,76.07087012168688
"Generation and analysis of a 29,745 unique Expressed Sequence Tags from the Pacific oyster (Crassostrea gigas) assembled into a publicly accessible database: the GigasDatabase",74.7035393812927
Nucleus segmentation across imaging experiments: the 2018 Data Science Bowl,73.00705617663002
Machine Learning for Fluid Mechanics,65.06692617382026
Leveraging Data Science to Combat COVID-19: A Comprehensive Review,62.754652671796485
An empirical study on data warehouse systems effectiveness: the case of Jordanian banks in the business intelligence era,61.48768174972165
A database of human segmented natural images and its application to evaluating segmentation algorithms and measuring ecological statistics,61.27447977543622
Genetic Algorithms in Search Optimization and Machine Learning,59.4014276136045
Gaussian Processes for Machine Learning (Adaptive Computation and Machine Learning),55.01137981690427
Data modelling for effective data warehouse architecture and design,51.29400010282979
CDD: a Conserved Domain Database for the functional annotation of proteins,50.618899323614905
Machine learning and data science in soft materials engineering,48.219236849863954
Towards Vagueness-Aware Semantic Data,45.746324397820956
CDD: NCBI's conserved domain database,44.09055285096922
HadoopRDF: A Scalable Semantic Data Analytical Engine,42.15094713109343
Microbiome data science,38.873677446352865
The carbohydrate-active enzymes database (CAZy) in 2013,37.833281008653124
Sparse and Dense Data with CNNs: Depth Completion and Semantic Segmentation,35.999737189045014
Applications of machine learning to machine fault diagnosis: A review and roadmap,35.089913975909845
Review on web search personalization through semantic data,17.36501745115822
The Data Warehouse Toolkit: Practical Techniques for Building Dimensional Data Warehouses,9.308768394957553
